<?xml version="1.0" encoding="UTF-8"?>
<!ELEMENT persons (person*)>
<!ELEMENT person (name?, age+, addr*, (m|f))>
<!ELEMENT name (#PCDATA)>
<!ELEMENT age (#PCDATA)>
<!ELEMENT addr (#PCDATA)>
<!ELEMENT m (#PCDATA)>
<!ELEMENT f (#PCDATA)>